text,rating,date
Refurbished IPhone 12. Immaculate and half the price of a new iPhone 14,5,2022/12/23
I am out of words to say that one is perfect phone for me.,5,2022/12/09
Am a regular apple user and this phone is great. I don’t think you need the latest model. The facial recognition makes it quicker to open. Camera good quality too.,5,2022/11/23
"I had one of these a while ago but it was the first that Apple brought out. When I got a new Apple I passed it onto the wife and she thought it was great, years pass and the phone packs up ( the battery) so I bought her the iPhone 12 upgraded version it’s taken a while to get her bearings on it but she getting there!",5,2022/10/28
As expected,5,2022/11/28
"Overall a very good phone, and serves its purpose- finally replaced my old iPhone 7. It needs a bit of getting used to slid to the next screen.
Saved £££ during Prime Day. Items arrived opened box and without a manual- but received an extra discount. Very pleased with the extra saving!",4,2022/10/19
So the phone works amazing had it for a good few months now and has done me wonders but the only problem is the battery seems to not last as long as it should do I don’t know if it got damaged on the way or that’s me just having to much of expectations but other than that I would recommend having this phone,4,2022/07/26
The iPhone 12 is the best iv had to date the quality of the graphics in games and the battery life is a lot better so would definitely recommend.,5,2022/10/23
Battery life is good nice colour all in all a good phone,4,2022/09/22
"I bought it for my son and he loves it. It works smoothly, it perfectly lies in the hand. Very fast delivery",5,2022/09/29
"My last iPhone was the 1st Gen iPhone SE in 2016, it was great however it had a small 32GB storage, I got rid of it because I kept running out of space and iCloud drive wasn't great at the time, hence I got the 256GB capacity iPhone 12

Been on Android for 5 years and it's been a welcome return back to iPhone, the phone is smooth, animations are immediate, FaceID has never let me down, with Apple's 20W charger, the charge time is pretty good too. iPhone 12 has wireless charging which makes it perfect to charge conveniently in the car.

Battery life is okay, nothing to write home about, I'm a power user and I can get 6 hours of screen on time day to day, and very rarely have I killed it in one day.

Design wise, if you loved the iPhone 4, you'll love this, it's an extension of that design idea, not slippery to hold like previous iPhones, this is Apple at it's best when it comes to industrial design.

Highly recommend the iPhone 12, I think it's the pick of the bunch since the Pro models have the same A14 processor and unless you really want LiDAR and the extra macro camera, I think this is the pick of the bunch.",5,2021/07/12
Battery efficiency good after few months use,4,2022/07/11
The face recognition very quick and efficient. Battery life better than my previous iPhone.,5,2022/09/25
Very pleased with my phone thanks,5,2022/09/25
iPhone is excellent does everything it’s supposed to do,5,2022/09/22
"A real bargain from Amazon warehouse. Came in pristine condition 100% battery and 9 months of Apple care still on the phone.
Happy customer and would definitely look at finding the same deal again in the future",5,2022/08/19
"Ordered to replace my iPhone 11. Phone has a great camera, facial recognition, easy to use, clear screen quality etc… but the battery does not last long at all. I feel I am constantly having to charge it up where I could have the same usage with my iPhone 11 and the battery would last all day.",3,2022/08/10
"This was a replacement for my ageing iPhone 7plus and it was worth the wait. I got this before the iPhone 13 was release at a very good price, its screen, battery life and speed are all excellent and with the longevity of the apple devices and the support for several years of updates I had no hesitation to buy another over the android devices that have very poor support for anything more than one year. I have been delighted with the ease of migrating data from one phone to the next which used wireless pairing and seamless migration of everything from my old phone to the new one. The camera is also excellent and its a nice device to hold too. Shame I have to put it in a case for work due to the hostile environments I work in. Otherwise I would recommend this to those looking for an upgrade from an older device at a more affordable price",5,2021/09/24
Had to send my XR back bad connection problems but usual excellent customer service from Amazon so decided to upgrade to a 12 not a lot of cosmetic difference between them nothing seem to change much on the working aspect of the phones keep giving fancy write ups re the camera but sadly a picture is a picture to me I don’t see the difference between any photos never really grasp the extortionate prices for I phones one is much like the other if you compare them on apples compare I phones there is very little difference in the phone apart from the price legalised extortion by apple really had all different models of iPhones since their conception only had trouble with the XR but the warranty covered that so see how this one goes,5,2021/12/24
"The iPhone 12 is a brilliant phone. I originally had an iPhone 8 and upgraded to the 12. The camera is brilliant - the pictures come out so crisp and look amazing. I like the more rounder edges of this iPhone as well. I got the iPhone 12 in blue and it looks so great, the picture of it doesn’t do it justice! The only downside of this is that due to the price I’d have hoped to have got headphones and I thankfully already had a mains plug but if someone else was buying an apple product for the first time then you will need to buy one or you aren’t able to charge your phone. The size is of this phone is great too, I’m so glad I didn’t go for the bigger size because this can fit into your pocket perfectly. I love that this has face recognition (what did I do before this?!) it’s so much easier to use now even though with having to use masks all the time right now it isn’t difficult for that but worth it if you aren’t needing to use Apple Pay!",5,2021/05/09
"The only thing I was pleasantly surprised about after a few days usage is the battery life, which I expected to be worse after reading other reviews. I'm coming from an iPhone 7 Plus that I used for 4 years, so I was expecting to notice the upgrade. I easily manage to get 30-40% charge at the end of the day with normal use (about 1h in voice calls, 15 minutes videocall, occasional YouTube videos, texting and 3-4 pictures throughout the day).
I'm not using the camera for pictures and videos much, as I prefer using my Fujifilm mirrorless for photography.
I love the blue color, but I am biased as it is my favorite. I was tempted by the black one, which I believe is going to be the most picked one. Face ID works like a charm. It's unfortunate we are in a pandemic and wear masks when shopping, so Face ID won't work for contactless payments. It does quickly switch to passcode though, so you can avoid removing your face covering, as you are not supposed to. I have tried recommended methods to make it work with a face covering, but it did not work for me.",5,2021/02/25
I am happy with my phone and the option of pay few pound per month interest free for 12 month,5,2022/08/05
"I like it, battery long life, the phone so good.",4,2022/04/30
"I purchased the iPhone 12 to replace my iPhone SE on which the battery was failing and needed recharging more than once a day. As soon as I received the new phone (the day after I ordered it, excellent service) I transferred the contents to the new phone without having to get assistance, so other than being a bit bigger it is as easy to use as the last phone. The keyboard is bigger so easier for me to type. Face recognition, the first time I have used it is brilliant but I fear I may forget my passwords as it is easier to use. All in all it is a great phone I haven’t used the camera yet, but I’m pretty sure it will be better than my old phone. Now charging once every two days, for now. I can only say that I love iPhones and think they are worth the extra money.👍",5,2021/08/15
"The last time I bought a new iPhone was in 2011, since then I’ve always bought 2nd hand because of the cost, but this time Amazon let me get the phone on monthly payments.
I went for the iPhone 12 256GB and WOW, I was impressed the 1st night I had it. I’m a photo taker and this phone just amazes me with the quality of the camera alone. All the photos were taken at night with NO flash and they look amazing.
Siri listens for the 1st time ever!
It’s soooooo loud compared to my old 7s Plus, it’s almost like I have a soundbar in my pocket!
I love the colour, I went for the Green one, well it is different!
It’s seriously fast too, once I ordered a 5G sim from my provider that is!
I have zero complaints about the phone, worth the money as I know it will last!",5,2021/08/21
I like it. No problem with it just like it’s says in description. Brand new. No damages. Working perfectly.,5,2022/07/20
I would never change an Iphone for Android,5,2022/08/13
Nothing special. Same as all iPhones. Only stay due to my music collection,3,2022/07/26
"I had struggled along for a while with my old 6s. Big mistake. Bought the twelve after reading all the reviews of 11-13. Very easy to set up from cloud. Love the magnetic cordless charging. Battery life seems endless compared to old phone. I do lots of calls,emails and SMS/WhatsApp messages and calls. Don't use camera that much. Great phone.",5,2022/04/18
"Expensive for what it is, but then all the newest phones are.
It is a nice phone though and I feel if you’ve had multiple iphones in the past, you know what it’s all about. It’ll take some adjusting to without having a home button at the bottom and a few additional button combinations and swipe patterns to get used.
The camera’s are a noticeable improvement, and I do like the face id to unlock - and when I’m wearing a face mask it will still unlock if it detects I’m wearing my apple watch so it knows it’s me.
The bigger screen is nice and I’m hoping the battery lasts longer with it being bigger but I have to say I do like having a phone you can operate with 1 hand and this does require 2 to reach all extremities of the screen.",5,2021/07/30
"The phone is fantastic. All the latest features, durable and a great battery",5,2022/07/17
"It's fairly responsive in touch and speed with opening apps
The camera doesn't feel that much improved but it's still very good

I'd say the best thing about the phone is the better CPU allow smooth operation and of course a better battery life

I've given 4 stars due to the fact that Apple take the liberty of removing earphones, chargers or adapters. I sincerely hope other companies don't follow suit.

It's crazy enough paying almost 1k for phones nowadays and to receive nothing else additional feels like robbery",4,2021/09/27
"Arrived on time, I upgraded from an iPhone X. Camera is really great and some nice new features",5,2022/07/10
"Easy to get used to the controls, arrived within 3 days, perfect",5,2022/07/08
Blue colour model has back panel which is not up to mark or colour is dull or different from online page,4,2022/02/23
"I bought this iPhone two days ago and it arrived today. I confess I was so afraid of being robbed on the way from UK to Dublin. Well, thank Gosh it didn't happen. I got it, recharged, put my acc on it, all my apps, SIM card and everything is absolutely fantastic. I don't think I need to write about the performance of the phone (because it's awesome) but I am sure to recommend if you are looking for a phone here in Amazon, check the sellers and the reviews and pray :D

Thank you",5,2021/11/15
Bought this phone sim free to replace my old iPhone 6s Plus. Fantastic phone that I’ve just had for over a week now and I love it. Really impressed by the quality of camera too. Great purchase!,5,2022/05/12
"Phone arrived on time, the currier arrived to the door and we both was scared on the trade of parcel for password and at the end we made safe; nothing wrong with the currier, the shipping was excellent. I turned on the phone and the system started with aggressive configurations and queries for phone identifier, I text a software engineer in the group to restore IMEI and component serial, technically the amazon control team was using a foreign country identification for myself name, and I am attending the reset to first start of the phone to obtain primary original IOS addons and amazon shopping reference in UK.",4,2021/06/07
Came in perfect conditions. No complaints,5,2022/06/23
"This is definitely my favourite iphone I have had so far, the design is great and feels really nice to hold and feels really smooth to use with its fast speeds, the camera takes really nice clear pictures and the video quality is great, also the sound from the speakers is great and loud which is good when watching videos and listing to music on, the screen size is also perfect for me as not to big and not to small, nice to watch YouTube and other videos on and also good for gaming as games also run nice and smooth. This is the perfect mobile phone for me as does everything i want and just the right size. Highly recommend this iphone as very happy with it.",5,2021/06/20
"Used Android phones for years, pretty much every pixel phone, and quite a few samsungs, thought it was time to try an iphone.

Love it, nice design, quality, great camera and battery life.

Everything about it feels premium.",5,2022/04/18
Apple rarely disappoint because they follow a formula that works. If you have used iPhone in the last 5 years. You come to expect what iPhone’s are capable with. This iPhone was purchased as an upgrade from an iPhone 8 Plus for my mum and it is an healthy upgrade. If you have an 11 or XR maybe wait till 14 because by that point their should be a noticeable upgrade.,5,2022/01/13
"Switching from Android to an iPhone for the 1st time was an adjustment but the phone is really easy to use, camera is great, battery life very good.
All in all very pleased with the iphone 12",5,2022/04/20
"Pros:
It gives premium feel and rich experience, which is obvious.
Camera is really good which iPhone is known for.

Cons:
Sometime it hangs all of a sudden. The app icons doesn't work at all. And I must restart the phone to make it work again. It may be one device issue but it shouldn't be even for one device given the price.

While talking on WhatsApp call, my voice won't go through if the other person is talking.",3,2022/02/07
"I bought this as an upgrade from iPhone 8. Love the face recognition , easy to set up from my old phone.
Camera is better. And bigger screen.",5,2022/05/10
"We always save up and purchase our phones out right and then get a monthly sim only deal as you save a fortune over a 2/3 year contract. This iPhone isn’t all bells and whistles - not a huge difference from our previous iPhone 7 Plus - however the camera is significantly better and the battery life lasts a whole day without charging and the face recognition is quick and easy - even wearing glasses or a mask! . Having said that, I probably don’t use all the features on it - so may be missing out on some major upgrades - but for my needs it’s perfect.
We are an Apple family and love them and if that’s the case, would recommend this phone.",5,2021/06/13
"Great phone, not a fan of the lack of a headphone port",5,2022/06/04
"Very good Smartphone - like ever - but one important thing is missing: FingerPrint reader. Nowadays where we are constantly using masks, just face recognition is not enough. It should have kept the fingerprint reader - in the same way I have in my old iPhone 8.

I have a Xiaomi that costs 30% - and IT contains both, face and fingerprint options. This is a very expensive product, should bring everything - including the charger... come on!",4,2021/07/27
"I am very satisfied with this phone. For my needs it’s absolutely fine: wonderful pictures, battery life is good, easy to use!",5,2022/05/17
My previous phone was an iPhone X and in its case the C fitted in most of my pockets the IPhone 12 is just a little bigger and once in the wallet it does not fit in most of my pockets,4,2021/10/29
It’s Apple and it’s an iPhone and as expected it’s exactly what I wanted. Face recognition is a massive improvement on using a finger.,5,2022/05/09
"Great phone, good price.",5,2022/06/14
"I moved to iphone from samsung just for camera quality. however if you are looking for best pictures, u still need to go for pro or even pro max. Before buying, i watched quite alot of youtube videos which compare the cameras and donot really find a big difference. In real life, when you put both iphone 12 and pro cameras together, it makes a difference in my personal view. Especially when it is dark, or complete opposite too bright ! So if you are buying mainly for camera and paying this money, just try yo go for pro if you can, if not, it is a great phone, great battery life, super fast... best iphone generation...",4,2021/02/14
"Absolute disappointment. Never had so many issues with network connection on any devices I owned. Week mobile reception, Wi-Fi is the worst won't connect or stay connected. Total garbage. Will sell it and never look on iphone again. Even Friking Poco F3 does better job for less than half price.",5,2022/02/17
Can’t go wrong,5,2022/06/13
"My old iPhone 7 broke. Bought this iPhone 12 to replace it. The colour blue is okay as expected. The bigger screen is what i wanted. Other functions are all similar to my iPhone 7, so i had no problem using it. It takes better pictures, comfortable to hold, battery life is okay so far as i turned icloud back-up off so the battery life lasts longer. I am quite happy with it.",4,2021/07/20
Would take a photo but can’t because I’m using the phone because it’s so good! It’s apple so you should expect it to be good. Came well packed and I damaged. Came on the day it said and was perfect.,5,2022/03/19
"This is a replacement for my iPhone 5, which tho working fine, could no longer download apps! 🤬. Love the phone & colour & all its additions. Size is great as my eyes are not. Only downside is the keys are a bit too small & I keep hitting wrong ones.",4,2021/09/21
"I’ve been needing to get a new phone for months and originally I was going to get an iPhone 11 but after the 11 being out of stock EVERYWHERE, I decided to buy the 12 since Amazon offered a pay-monthly scheme for it. The payments are £145.80 spread over 5 months which is really good and overall works out cheaper for me.

The colour is gorgeous, the camera is excellent and overall it’s a very good phone. Really pleased :)",5,2021/10/16
Great phone and easy to use.,5,2022/06/02
My iPhone 7 was no longer keeping up so I took the plunge for a new phone. The technology is mind boggling and the device is beautiful. Facial recognition works even in the dark making this phone even more user friendly and convenient.,5,2022/03/01
"All my Busines and family activity.
I should not have bought it. Facial recognition good. Battery life awful. Should gone for iPhone 13.",3,2022/04/18
"Great phone, a lot of money but they usually last long. The finishing on the back (shiny on the standard 12) is a bit annoying as it gets full of fingertips, the lack of headphones and charging brick is a joke for the money you spend.
The building quality is amazing, the software is brilliant and the transition from another iPhone is amazing.",4,2021/07/12
Just bought this iPhone 12 in purple beautiful phone really great price on Amazon thank you! Very easy to set up and install from your old iPhone there is definitely a difference between the iPhone 11 and this iPhone 12 well worth buying this is my favourite iPhone and I’ve ever owned and I’ve had iPhones since iPhone 4 very good experience buying from Amazon as i was able to pay monthly interest free instead of outright like I’ve done previously with apple just noticed it’s 20 % off today so even more reason to buy this stunning iPhone from apple via Amazon as far cheaper than apple store,5,2021/05/04
"Really nice phone to be honest. Always been an android user. Slowly been moving over to apple devices elsewhere and decided for this upgrade to switch. The eco system is fantastic and the iPhone 12 just completes it. The battery life is phenomenal, I’m not glued to my phone so obviously your mileage will vary. But it always last the day and will charge to 80% to preserve the life of the battery. As I don’t require a full charge each day. Really snappy and hasn’t let me down once yet on the 3 months I’ve had it.",5,2021/06/25
"I bought this for my son and I don't know the first thing about technology but I know that he wanted a iPhone so I read the reviews and decided to buy it for him off Amazon, I checked around to make sure I was paying the right price and I do trust Amazon so my thinking was if it's not what he wants I can return it and get a full refund. He loves it and says it's much better than the phone he had which isn't a iPhone but a good one nethertheless. He went for a walk and sent me the above picture on his new iphone it was getting dark and the quality is exceptional compared to his old phone. He said it's brilliant and would highly recommend it.",5,2020/12/14
"I decided to buy a new phone as opposed to a secondhand phone, although it’s very expensive it’s what I have been using for years! Still working out how everything works!",5,2022/03/14
This iPhone 12 have been amazing the battery life would last even the whole day I love it only thing I dislike is that we weren’t given a proper charger,5,2022/03/15
"I’ve had an iPhone 6s for some years and decided to upgrade to an iPhone 12. I thought I’d notice a difference but apart from having lots of storage I’m disappointed with my new phone, nothing seems any different with it, for example battery life is still poor, downloading speed still quite slow etc, not sure it was worth the money",3,2021/12/29
"I changed from an 11 Pro Max to the 12 because I like to keep up to date, even though to be honest it doesn't feel any faster because it shares the same gig mem. But I was a little tired of the weight and size of the 11 Pro Max and enjoy the smaller form factor of the 12. Though I must say I didn't see the phone in person (in an Apple store) before I purchased online, and I wouldn't call it red, more like a dark salmon in colour. If I had seen it in person first, I would have gone for another colour. But then again, after the case is on, all I see is the camera cut out.",5,2020/12/28
Nothing new,5,2022/05/20
"iPhone 12, is a phone worth purchasing. I found it abit challenging at first not being able to find my way around the interface, however, now I have adjusted, thumbs up.

Face recognition is new to me and I now find it very useful when not wearing a mask 😂. Battery life is excellent.
I also like the feature were I can set it on 4G/5G.",5,2021/09/22
"The phone is as expected.
However just pray you don’t have any issues.
I had issues and Amazon and Amazon’s customer service is simply shocking.
You pay over £800 for a phone and have a problem within 24 hours, I expect a replacing phone not a repair!!
I ended up going to the apple store in birmingham who sorted the phone.
I’ll never buy an item like this from Amazon again",5,2021/08/25
"Small improvement but does feel better to hold, the camera is miles ahead of the X too. Upgraded due to iphone X age had decreased perfomance, maybe hold out for next release if you are with an iphone x still",4,2021/07/25
"I have been an android user since I switched from my iPhone 4 back in 2011. This design really takes me back and I’ve got to admit Apple have done a superb job here.

I’ve recently used the pixel 2xl and the pixel 3a and considering google have done a really good job with their own stripped back software, for me it’s nowhere near to Apple.

The iPhone 12 feels and looks premium and the iOS is a game changer compared to Android.

Personally I prefer to purchase my phones out right than sign up to a 24 month contract. Depending on what sim deal you can find you could save around £400 to £600 over 2 years so it’s always worth checking.

Overall it’s a great iPhone and looks fantastic in blue.!",5,2020/12/02
"The iPhone 12 is superb it is the perfect middle of the road phone. Its updated to latest specs and software does what ever is needed.
Its an excellent phone its screen is the perfect size, especially now that I just upgraded from iPhone 7. so its a world of a difference. the only issues are the price it is overpriced and the faceID which I feel is a step down from the more secure touchID and too much of a gimmick.
The battery is outstanding it literally lasts all day - 2 days without recharge especially if you’re a light user!
A superb all around phone.",5,2021/04/03
"Having upgraded from an iPhone7 I’m absolutely loving the 12. Have got used to facial recognition & swiping very quickly. As always, transferring phone info over was very quick & simple. I’ve watched a couple of YouTube videos to understand the extra/different functionality which has really helped. Battery life is definitely much better than my 7. All in all I’m very happy with the 12.",5,2021/08/06
"I fell in love with the phone. But, my service provider couldn't facilitate eSIM. And it's very difficult to change eSIM for any emergency needs or we travel to other places and wants to use new SIM.
Apple should have provided Dual Nano SIM's. eSIM's will be difficult process for everyone to get and configure it. I'm sure not even 0.5% of iPhone users are adaptive to eSIM.",5,2021/08/08
